Campeonato:,Campeonato Brasileiro - Série B/2021,,Rodada:,36
Jogo:,Coritiba / PR X Brasil / RS,,,
Data:,14/11/2021 Horário: 18:15 Estádio:,Major Antônio Couto Pereira / Curitiba,,
"",,Arbitragem
Arbitro:,Diego Pombo Lopez (AB / BA),
Arbitro Assistente 1:,Edevan de Oliveira Pereira (AB / BA),
Arbitro Assistente 2:,Luanderson Lima dos Santos (AB / BA),
Quarto Arbitro:,Gustavo Nogas (CD / PR),
Analista de Campo:,Ronaldo Parpinelli (CBF / PR),
VAR:,Jose Claudio Rocha Filho (VAR-FIFA / SP),
"",,,Cronologia,,,
"",1o Tempo,,2o Tempo,,,
Entrada do mandante:,18:05Atraso:,,Não Houve Entrada do mandante: 19:19,,Atraso:,Não Houve
Entrada do visitante:,18:05Atraso:,,Não Houve Entrada do visitante: 19:18,,Atraso:,Não Houve
Início 1o Tempo:,18:15Atraso:,,Não Houve Início do 2o Tempo: 19:21,,Atraso:,Não Houve
Término do 1o Tempo:,19:06Acréscimo:,,6 min Término do 2o Tempo: 20:12,Acréscimo:,,6 min
Resultado do 1o Tempo: 0 X 0,,,Resultado Final: 2 X 1,,,
"",,,,,Relação de Jogadores,,,,
"",,Coritiba / PR,,,,Brasil / RS,,,
No,Apelido,Nome Completo T/R,,P/A,CBF No Apelido,Nome Completo T/R,,P/A,CBF
84,Wilson,Wilson Rodrigues de  ... T(g),,P,155508 1 Marcelo,Marcelo de Bem Dal Soler T(g),,P,509383
3,Henrique,Henrique Adriano Buss T,,P,161301 3 Leandro Ca ...,Leandro Camilo de Almeida T,,P,172296
4,Luciano Ca ...,Luciano Castan da Silva T,,P,292282 4 Icaro,Icaro Cosmo da Rocha T,,P,184967
7,Rafinha,Rafael da Silva Francisco T,,P,151708 5 Diego,Diego Gomes dos Santos T,,P,365265
8,Willian Fa ...,Willian Roberto de Farias T,,P,180083 6 Heverton,Heverton Cardoso da Silva T,,P,185586
9,Leo Gamalho,Leonardo Gamalho de SouzaT,,P,168982 7 Patrick,Patrick Machado Ferreira T,,P,423224
13,Waguininho,Wagner da Silva Souza T,,P,300229 8 Bruno,Bruno Matias dos Santos T,,P,452427
16,Natanael M ...,Natanael Moreira Milouski T,,P,559812 9 Erison,Erison Danilo de Souza T,,P,605477
18,Guilherme  ...,Guilherme da Trindad ... T,,P,435961 10 Rildo,Rildo Goncalves de A ... T,,P,432199
20,Robinho,Robson Michael Signorini T,,P,172189 11 Renatinho,Renato Vieira Rodrigues T,,P,301503
97,Val,Valdemir de Oliveira ... T,,P,444950 13 Netto,Clairton Norchang Netto T,,P,403332
23,Alex Muralha,Alex Roberto Santana ... R(g),,P,177010 12 Matheus,Matheus Nogueira da SilvaR(g),,P,177903
2,Matheus Al ...,Matheus Alexandre An ... R,,P,517052 14 Alan,Alan Carlos de Paula ... R,,P,439083
5,Jhony Douglas,Jhony Douglas Santiago R,,P,374851 16 Paulinho,Paulo Oliveira de So ... R,,P,184316
17,Guilherme  ...,Guilherme da Silva A ... R,,P,521902 17 Poveda,Gabriel Buscariol Poveda R,,P,338185
19,Joao Vitor ...,Joao Vitor Moreira d ... R,,P,516144 18 Caio Rangel,Caio Rangel da Silva R,,P,313031
34,Wellington ...,Wellington Carvalho  ... R,,P,307674 19 Rone,Rone Carlos de Paula R,,P,445174
36,Matheus Sales,Matheus de Sales Cabral R,,P,338849 20 Oliveira,Jheckson Silva Oliveira R,,P,306314
37,Romario,Romario Guilherme do ... R,,P,305959 22 Vidal,Cristiano da Silva Vidal R,,P,329349
44,Marcio Silva,Marcio Gleyson Leite ... R,,P,547120 23 Vitor,Vitor Monteiro Luiz R,,P,381907
75,Biel,Luiz Gabriel de Oliv ... R,,P,461774,,,,
94,Dalberto,Dalberto Luan Belo R,,P,389256,,,,
95,William Alves,William Alves de Oliveira R,,P,306591,,,,
"",,Comissão Técnica,
"",Coritiba / PR,,Brasil / RS
Técnico:,Gustavo Eliseo Morinigo Vazquez,Técnico:,Jerson Testoni
Assistente Técnico:,Roberto Miguel Acuna Cabello,Assistente Técnico:,Jeferson Cirilo Mesquita Da Martha
Médico:,Milton Massahide Nagai,Médico:,Leonardo Dos Reis Goulart
Treinador De Goleiros:,Jose Luiz Baptista De Leao,Treinador De Goleiros:,Alex Lessa Afonso
Preparador Físico:,Gonzalo Luis Llanos,Preparador Físico:,Marcos Vinicius Monassa Abella
Fisioterapeuta:,Juarez Telles Netto,Massagista:,Paulo Sergio Goncalves Teixeira
"",,,,,Gols,
Tempo,1T/2T,No,Tipo,Nome do Jogador,,Equipe
09:00,2T,13,NR,Wagner da Silva Souza,,Coritiba/PR
36:00,2T,9,PN,Erison Danilo de Souza,,Brasil/RS
+3,2T,9,NR,Leonardo Gamalho de Souza,,Coritiba/PR
"",,,,Substituições,
Tempo,1T/2T,,Equipe,Entrou,Saiu
+5:00,2T,Coritiba/PR,,36 - Matheus de Sales Cabral,20 - Robson Michael Signorini
+5:00,2T,Coritiba/PR,,37 - Romario Guilherme dos Santos,13 - Wagner da Silva Souza
45:00,INT,Brasil/RS,,20 - Jheckson Silva Oliveira,11 - Renato Vieira Rodrigues
45:00,INT,Brasil/RS,,18 - Caio Rangel da Silva,10 - Rildo Goncalves de Amorim Fi...
15:00,2T,Brasil/RS,,17 - Gabriel Buscariol Poveda,7 - Patrick Machado Ferreira
15:00,2T,Brasil/RS,,16 - Paulo Oliveira de Souza Junior,6 - Heverton Cardoso da Silva
44:00,2T,Coritiba/PR,,95 - William Alves de Oliveira,97 - Valdemir de Oliveira Soares
44:00,2T,Coritiba/PR,,19 - Joao Vitor Moreira dos Santos,7 - Rafael da Silva Francisco
